{
  "schemaVersion": 2,
  "name": "Round-trip da conclusão da tentativa de autenticação",
  "inputs": [],
  "actions": [
    {
      "id": "concluir-tentativa-autenticacao",
      "type": "completeAuthenticationAttempt",
      "name": "Concluir tentativa de autenticação"
    }
  ],
  "subflows": {}
}
