{
  "schemaVersion": 2,
  "name": "RPA de exemplo",
  "inputs": [],
  "actions": [
    {
      "id": "iniciar-fluxo",
      "type": "setVariable",
      "name": "Iniciar fluxo",
      "value": "pronto",
      "output": "runtime.estado",
      "clearFirst": false,
      "blurAfter": false,
      "optional": false,
      "actions": [],
      "elseActions": []
    }
  ],
  "subflows": {}
}
